{
  "id": "decision-record-003",
  "title": "Classify Decisions by Impact and Reversibility",
  "status": "accepted",
  "date": "2024-01-03",
  "decision": "Introduce decision tiers and reversibility semantics to distinguish ordinary decisions from costly and irreversible ones.",
  "context": "Without explicit tiering, DMP risks either overuse or underuse, reducing its effectiveness.",
  "rationale": "Decision memory is most valuable when forgetting is dangerous. Tiering clarifies when DMP is required.",
  "consequences": "Teams gain a shared understanding of which decisions demand durable memory and review.",
  "tier": "tier-1",
  "reversibility": "partially-reversible",
  "alternatives": [
    "Require DMP for all decisions",
    "Leave decision importance undefined"
  ],
  "supersedes": "decision-record-002"
}
